{
  "invoice_number": "DS-ASE-INV-ES-2024-33264305",
  "issue_date": "28/04/2024",
  "vendor_name": "HONG KONG UGREEN LIMITED",
  "vendor_tax_id": "LU19647148",
  "vendor_address": "3 TAI YU STREET, SAN PO KONG, KL, HONG KONG, HONG KONG, 999077 HK",
  "buyer_name": "Carlos Lorenzo",
  "buyer_tax_id": "N/A",
  "buyer_address": "Avenida Isabel de Valois 90, Bajo A, Madrid, Madrid, 28050, ES",
  "line_items": [
    {
      "description": "UGREEN Revodok Pro 210 Docking Station USB C 10 En 1 Doble HDMI 8K30Hz 4K60Hz Hub Adaptador USB C a 2 HDMI Ethernet Gigabit USB 3.0 PD 100W Lector Tarjeta SD TF Compatible con MacBook Pro Air M2 M1",
      "qty": "1",
      "unit_price": "57,84 €",
      "line_total": "69,99 €",
      "line_tax_rate": "21%",
      "line_tax_amount": "12,15 €"
    }
  ],
  "taxable_base": "57,84 €",
  "vat_rate": "21%",
  "vat_amount": "12,15 €",
  "total_amount": "69,99 €",
  "payment_terms": "Pago pendiente",
  "currency": "EUR",
  "metadata": {
    "source_file": "invoice-5.pdf",
    "ocr_engine": "hybrid",
    "extraction_timestamp": "2025-05-08T17:36:59.662974",
    "confidence_score": 0.9351470588235293
  }
}